{
  "id": "INTOV_078",
  "severity": "MEDIUM",
  "title": "Integer Overflow in Balance Calculation",
  "category": "INTEGER_OVERFLOW",
  "subcategory": "Arithmetic Overflow",
  "description": "The calculateReward() function performs arithmetic operations without overflow protection. When the reward multiplier is large, the calculation can overflow, resulting in incorrect reward amounts that may be exploited to mint excessive tokens.",
  "recommendation": {
    "summary": "Use OpenZeppelin's SafeMath library or Solidity 0.8.0+ with built-in overflow checks",
    "details": "1. Upgrade to Solidity 0.8.0 or later for automatic overflow protection\n2. If using older Solidity versions, implement SafeMath library\n3. Add explicit require() checks for maximum values\n4. Consider using unchecked blocks only where overflow is intentionally allowed\n5. Add comprehensive unit tests for edge cases with large numbers",
    "code_example": "// Solidity 0.8.0+\nfunction calculateReward(uint256 amount, uint256 multiplier) public pure returns (uint256) {\n    // Built-in overflow protection\n    return amount * multiplier;\n}\n\n// Or with SafeMath for older versions\nusing SafeMath for uint256;\n\nfunction calculateReward(uint256 amount, uint256 multiplier) public pure returns (uint256) {\n    return amount.mul(multiplier);\n}\n\n// Or with explicit checks\nfunction calculateReward(uint256 amount, uint256 multiplier) public pure returns (uint256) {\n    require(multiplier <= 1000, \"Multiplier too large\");\n    require(amount <= type(uint256).max / multiplier, \"Overflow risk\");\n    return amount * multiplier;\n}",
    "references": [
      {
        "title": "OpenZeppelin SafeMath",
        "url": "https://docs.openzeppelin.com/contracts/2.x/api/math#SafeMath",
        "type": "documentation"
      },
      {
        "title": "Solidity 0.8.0 Changes",
        "url": "https://docs.soliditylang.org/en/v0.8.0/080-breaking-changes.html",
        "type": "documentation"
      }
    ]
  },
  "location": {
    "file": "RewardCalculator.sol",
    "line": 78,
    "column": 16,
    "function": "calculateReward",
    "contract": "RewardCalculator",
    "code_snippet": "function calculateReward(uint256 amount, uint256 multiplier) public pure returns (uint256) {\n    uint256 baseReward = amount * multiplier;\n    uint256 bonus = baseReward * 150 / 100; // Potential overflow here\n    return baseReward + bonus;\n}"
  },
  "confidence": {
    "level": "MEDIUM",
    "score": 0.78,
    "reasoning": "Arithmetic operations without overflow checks detected, but actual exploitation requires specific input values"
  },
  "impact": {
    "financial": {
      "risk_level": "MEDIUM",
      "potential_loss": "Incorrect reward calculations could lead to token inflation",
      "affected_funds": "Reward pool and token supply integrity"
    },
    "operational": {
      "availability": "LOW",
      "functionality": "MINOR_DEGRADATION",
      "governance": "NONE"
    },
    "reputation": {
      "risk_level": "MEDIUM",
      "description": "Incorrect rewards could damage user trust in the reward mechanism"
    }
  },
  "exploitability": {
    "ease": "MODERATE",
    "prerequisites": [
      "Attacker needs to find input values that cause overflow",
      "Function must be externally callable",
      "Contract must use Solidity version < 0.8.0"
    ],
    "attack_vector": "NETWORK",
    "user_interaction": "REQUIRED"
  },
  "evidence": {
    "pattern_matches": [
      {
        "pattern": "unchecked_arithmetic_operation",
        "match": "amount * multiplier",
        "confidence": 0.85
      },
      {
        "pattern": "potential_overflow_multiplication",
        "match": "baseReward * 150 / 100",
        "confidence": 0.72
      }
    ],
    "static_analysis": {
      "tool": "Mythril",
      "rule": "integer-overflow",
      "output": "Integer overflow at RewardCalculator.sol:79"
    },
    "ai_analysis": {
      "model": "GPT-4-Turbo",
      "reasoning": "Multiple arithmetic operations without overflow protection in a financial calculation function",
      "similarity_score": 0.81
    }
  },
  "metadata": {
    "cwe_ids": ["CWE-190", "CWE-191"],
    "owasp_categories": ["SC03:Arithmetic Issues"],
    "tags": ["arithmetic", "overflow", "rewards", "tokens"],
    "false_positive_likelihood": 0.15,
    "historical_incidents": [
      {
        "name": "BatchOverflow (BEC Token)",
        "year": 2018,
        "loss_amount": "Market disruption",
        "url": "https://medium.com/@peckshield/alert-new-batchoverflow-bug-in-multiple-erc20-smart-contracts-cve-2018-10299-511067db6536"
      }
    ]
  },
  "timestamp": "2024-01-15T14:35:00Z",
  "scanner": {
    "name": "AI Blockchain Analytics",
    "version": "2.1.0",
    "scan_id": "scan_789abc123",
    "configuration": {
      "ai_model": "gpt-4-turbo",
      "static_analyzers": ["slither", "mythril"],
      "analysis_depth": "comprehensive"
    }
  },
  "remediation": {
    "effort": "LOW",
    "timeline": "Next release cycle - low urgency",
    "priority": 5,
    "status": "OPEN"
  }
}