{
  "id": "REENT_001",
  "severity": "CRITICAL",
  "title": "Cross-function Reentrancy in Token Transfer",
  "category": "REENTRANCY",
  "subcategory": "Cross-function Reentrancy",
  "description": "The contract is vulnerable to cross-function reentrancy attacks. The transfer() function can be re-entered through the transferFrom() function during external calls, allowing attackers to manipulate balances and potentially drain funds.",
  "recommendation": {
    "summary": "Implement reentrancy guards and follow the Checks-Effects-Interactions pattern consistently across all functions",
    "details": "1. Add OpenZeppelin's ReentrancyGuard to all state-changing functions\n2. Update all balance state variables before making external calls\n3. Use pull payment pattern where possible\n4. Consider using transfer() or send() instead of call() for Ether transfers\n5. Audit all functions that make external calls for similar patterns",
    "code_example": "import \"@openzeppelin/contracts/security/ReentrancyGuard.sol\";\n\ncontract SecureToken is ReentrancyGuard {\n    function transfer(address to, uint256 amount) external nonReentrant {\n        require(balances[msg.sender] >= amount, \"Insufficient balance\");\n        balances[msg.sender] -= amount;  // Update state first\n        balances[to] += amount;\n        \n        // External call last\n        if (to.isContract()) {\n            IERC777Recipient(to).tokensReceived(...);\n        }\n    }\n}",
    "references": [
      {
        "title": "ConsenSys Best Practices - Reentrancy",
        "url": "https://consensys.github.io/smart-contract-best-practices/attacks/reentrancy/",
        "type": "best_practice"
      },
      {
        "title": "OpenZeppelin ReentrancyGuard",
        "url": "https://docs.openzeppelin.com/contracts/4.x/api/security#ReentrancyGuard",
        "type": "documentation"
      }
    ]
  },
  "location": {
    "file": "VulnerableToken.sol",
    "line": 87,
    "column": 9,
    "function": "transfer",
    "contract": "VulnerableToken",
    "code_snippet": "function transfer(address to, uint256 amount) external {\n    require(balances[msg.sender] >= amount);\n    to.call{value: amount}(\"\"); // External call before state update\n    balances[msg.sender] -= amount;\n    balances[to] += amount;\n}"
  },
  "confidence": {
    "level": "HIGH",
    "score": 0.98,
    "reasoning": "Clear pattern match with external call before state update, confirmed by control flow analysis"
  },
  "impact": {
    "financial": {
      "risk_level": "CRITICAL",
      "potential_loss": "Unlimited - entire contract balance",
      "affected_funds": "All tokens and Ether held by contract"
    },
    "operational": {
      "availability": "HIGH",
      "functionality": "COMPLETE_LOSS",
      "governance": "NONE"
    },
    "reputation": {
      "risk_level": "HIGH",
      "description": "Complete loss of user funds would severely damage protocol reputation"
    }
  },
  "exploitability": {
    "ease": "EASY",
    "prerequisites": [
      "Attacker must deploy malicious contract",
      "Contract must hold Ether balance",
      "Attacker needs initial token balance"
    ],
    "attack_vector": "NETWORK",
    "user_interaction": "NONE"
  },
  "evidence": {
    "pattern_matches": [
      {
        "pattern": "external_call_before_state_update",
        "match": "to.call{value: amount}(\"\"); balances[msg.sender] -= amount;",
        "confidence": 0.95
      }
    ],
    "static_analysis": {
      "tool": "Slither",
      "rule": "reentrancy-eth",
      "output": "Reentrancy in VulnerableToken.transfer(address,uint256)"
    },
    "ai_analysis": {
      "model": "GPT-4-Turbo",
      "reasoning": "The function makes an external call to an untrusted address before updating the sender's balance, creating a classic reentrancy vulnerability",
      "similarity_score": 0.92
    }
  },
  "metadata": {
    "cwe_ids": ["CWE-841", "CWE-663"],
    "owasp_categories": ["SC01:Reentrancy"],
    "tags": ["token", "finance", "drain_attack", "critical"],
    "false_positive_likelihood": 0.02,
    "historical_incidents": [
      {
        "name": "The DAO Attack",
        "year": 2016,
        "loss_amount": "$60 million",
        "url": "https://hackingdistributed.com/2016/06/18/analysis-of-the-dao-exploit/"
      },
      {
        "name": "SpankChain Payment Channel",
        "year": 2018,
        "loss_amount": "$40,000",
        "url": "https://medium.com/spankchain/we-got-spanked-what-we-know-so-far-d5ed3a0f38fe"
      }
    ]
  },
  "timestamp": "2024-01-15T14:30:00Z",
  "scanner": {
    "name": "AI Blockchain Analytics",
    "version": "2.1.0",
    "scan_id": "scan_789abc123",
    "configuration": {
      "ai_model": "gpt-4-turbo",
      "static_analyzers": ["slither", "mythril"],
      "analysis_depth": "comprehensive"
    }
  },
  "remediation": {
    "effort": "MEDIUM",
    "timeline": "Immediate - deploy fixed version ASAP",
    "priority": 1,
    "status": "OPEN"
  }
}