{
  "id": "GAS_156",
  "severity": "LOW",
  "title": "Inefficient Gas Usage in Loop Operations",
  "category": "GAS_LIMIT_ISSUES",
  "subcategory": "Gas Optimization",
  "description": "The processUsers() function contains a loop that reads from storage in each iteration without caching values. This results in excessive gas consumption and potential out-of-gas errors when processing large arrays, making the function unusable with many users.",
  "recommendation": {
    "summary": "Cache storage variables outside loops and consider implementing pagination for large data sets",
    "details": "1. Cache frequently accessed storage variables in memory before the loop\n2. Implement pagination to process users in batches\n3. Use memory arrays where possible instead of repeated storage access\n4. Consider using mapping iteration patterns for better gas efficiency\n5. Add gas estimation and limits to prevent out-of-gas scenarios",
    "code_example": "// Before (inefficient)\nfunction processUsers(address[] calldata users) external {\n    for (uint i = 0; i < users.length; i++) {\n        userBalances[users[i]] += baseReward; // Storage read/write each iteration\n        userTimestamps[users[i]] = block.timestamp;\n    }\n}\n\n// After (optimized)\nfunction processUsers(address[] calldata users, uint256 startIndex, uint256 batchSize) external {\n    uint256 endIndex = startIndex + batchSize;\n    if (endIndex > users.length) {\n        endIndex = users.length;\n    }\n    \n    uint256 currentReward = baseReward; // Cache storage variable\n    uint256 currentTimestamp = block.timestamp;\n    \n    for (uint256 i = startIndex; i < endIndex; i++) {\n        userBalances[users[i]] += currentReward;\n        userTimestamps[users[i]] = currentTimestamp;\n    }\n}",
    "references": [
      {
        "title": "Ethereum Gas Optimization Techniques",
        "url": "https://ethereum.org/en/developers/docs/gas/",
        "type": "documentation"
      },
      {
        "title": "Solidity Gas Optimization Guide",
        "url": "https://mudit.blog/solidity-gas-optimization-tips/",
        "type": "best_practice"
      }
    ]
  },
  "location": {
    "file": "UserProcessor.sol",
    "line": 156,
    "column": 9,
    "function": "processUsers",
    "contract": "UserProcessor",
    "code_snippet": "for (uint i = 0; i < users.length; i++) {\n    userBalances[users[i]] += baseReward;\n    userTimestamps[users[i]] = block.timestamp;\n    totalProcessed += 1;\n}"
  },
  "confidence": {
    "level": "HIGH",
    "score": 0.91,
    "reasoning": "Clear pattern of inefficient storage access in loops, easily identifiable gas optimization opportunity"
  },
  "impact": {
    "financial": {
      "risk_level": "LOW",
      "potential_loss": "Increased transaction costs for users",
      "affected_funds": "User gas fees"
    },
    "operational": {
      "availability": "MEDIUM",
      "functionality": "MINOR_DEGRADATION",
      "governance": "NONE"
    },
    "reputation": {
      "risk_level": "LOW",
      "description": "High gas costs may deter users but unlikely to cause significant reputation damage"
    }
  },
  "exploitability": {
    "ease": "VERY_DIFFICULT",
    "prerequisites": [
      "No direct exploitation possible",
      "Function may become unusable with large inputs"
    ],
    "attack_vector": "LOCAL",
    "user_interaction": "REQUIRED"
  },
  "evidence": {
    "pattern_matches": [
      {
        "pattern": "storage_access_in_loop",
        "match": "userBalances[users[i]] += baseReward",
        "confidence": 0.95
      },
      {
        "pattern": "repeated_timestamp_access",
        "match": "block.timestamp",
        "confidence": 0.87
      }
    ],
    "static_analysis": {
      "tool": "Slither",
      "rule": "costly-loop",
      "output": "Costly operations inside processUsers loop"
    },
    "ai_analysis": {
      "model": "GPT-4-Turbo",
      "reasoning": "Loop performs multiple storage operations that could be optimized by caching values in memory",
      "similarity_score": 0.88
    }
  },
  "metadata": {
    "cwe_ids": ["CWE-405"],
    "owasp_categories": ["SC10:Gas Limit and Loops"],
    "tags": ["gas_optimization", "performance", "loops", "storage"],
    "false_positive_likelihood": 0.05,
    "historical_incidents": []
  },
  "timestamp": "2024-01-15T14:38:00Z",
  "scanner": {
    "name": "AI Blockchain Analytics",
    "version": "2.1.0",
    "scan_id": "scan_789abc123",
    "configuration": {
      "ai_model": "gpt-4-turbo",
      "static_analyzers": ["slither", "mythril"],
      "analysis_depth": "comprehensive"
    }
  },
  "remediation": {
    "effort": "LOW",
    "timeline": "Next optimization cycle - no urgency",
    "priority": 8,
    "status": "OPEN"
  }
}